ReferenceID,TypeofChange,Location,OldText,NewTextEN,NewTextFR,NewTextES,Language,Change to Structure,Text Change,Owner,LocationofJSON,Priority,Complete
C0112,New Popup,"Ph. A Step 8 -- New gender pop up called ""Gender checklist""",,"Add gender pop up called ""Gender Checklist"", with the following text for the body:                                                                
Here are some important elements to consider when developing your COBHRA process: 
o	Balanced gender composition of assessment team 
o	Assessment team includes at least one gender expert, and external gender expertise consulted if/when necessary 
o	Sufficient % consultations with women or gender diverse peoples for each stakeholder group
o	At each stage (initial consultations, focus group, interviews, feedback sessions), the assessment team met with women and gender diverse peoples separately than men 
▪	Note: this includes female facilitators and translators 
o	Language and information materials accessible to women and gender diverse peoples 
o	Sufficient information on impact on women/girls/gender diverse peoples for each right? 
o	Identify practical and cultural barriers to women’s and gender diverse peoples’ participation and ways to overcome these (for example, the company could consider providing childcare services or making sure the space provided for meetings is child friendly)
o	Identify any safety risks related to women’s or gender diverse peoples’ participation and implement ways to mitigate these risks 
o	Are women more, less or equally supportive of the investment project than men? 
•	You should revisit this checklist in different moments of your process to evaluate which of these practices are not sufficiently integrated and develop a strategy on how to better incorporate those elements going forward.","Liste de contrôle du genre
Voici quelques éléments importants à prendre en compte lors de l'élaboration de votre processus COBHRA : 
-	Composition de l'équipe d'évaluation équilibrée entre les genres 
-	L'équipe d'évaluation comprend au moins un expert en matière de genre, et des experts externes en matière de genre sont consultés si/quand cela est nécessaire. 
-	Un pourcentage suffisant de consultations avec des femmes ou des personnes de genres variés pour chaque groupe de parties prenantes.
-	A chaque étape (consultations initiales, groupe de discussion, entretiens, sessions de feedback), l'équipe d'évaluation a rencontré les femmes et les personnes non-conformes au genre séparément des hommes. Note : cela inclut les animatrices et les traductrices. 
-	Langue et matériel d'information accessibles aux femmes et aux personnes non-conformes au genre. 
-	Informations suffisantes sur l'impact sur les femmes/filles/personnes non-conformes au genre pour chaque droit ? 
-	Identifier les obstacles pratiques et culturels à la participation des femmes et des personnes non-conformes au genre et les moyens de les surmonter (par exemple, l'entreprise pourrait envisager de fournir des services de garde d'enfants ou de s'assurer que l'espace prévu pour les réunions est adapté aux enfants).
-	Identifier les risques de sécurité liés à la participation des femmes ou des personnes non-conformes au genre et mettre en œuvre des moyens pour atténuer ces risques. 
-	Les femmes soutiennent-elles plus, moins ou autant que les hommes le projet d'investissement ? 
 Vous devriez revoir cette liste de contrôle à différents moments de votre processus pour évaluer quelles sont les pratiques qui ne sont pas suffisamment intégrées et développer une stratégie sur la façon de mieux intégrer ces éléments à l'avenir.","Lista de cotejo de cuestiones de género
A continuación enunciamos algunos elementos importantes que deben considerar al desarrollar el proceso de su COBHRA: 
o	Composición de género equilibrada en el equipo de evaluación 
o	Que en el equipo de evaluación haya al menos una persona experta en género y que se consulte a gente externa entendida en cuestiones de género cuando haga falta 
o	% suficiente de consultas con mujeres o personas de género diverso por cada grupo de interesados
o	En cada etapa (consultas iniciales, grupo de sondeo, entrevistas, sesiones de comentarios), el equipo de evaluación se sesionó con mujeres y personas de género diverso por separado de los hombres 
▪	Nota: esto abarca facilitadoras e intérpretes mujeres 
o	Lenguaje y materiales de información al alcance de las mujeres y las personas de género diverso 
o	¿Información suficiente sobre el impacto en las mujeres / muchachas / personas de género diverso por cada derecho? 
o	Identificar barreras prácticas y culturales a la participación de las mujeres y personas de género diverso y modos de superar dichas barreras (por ejemplo, la empresa podría considerar proporcionar servicios de guardería o asegurarse de que el espacio proporcionado para las reuniones sea acogedor para menores de edad)
o	Identificar cualquier riesgo de seguridad relacionado con la participación de las mujeres o personas de género diverso e implementar maneras de mitigar estos riesgos
o	¿Las mujeres apoyan el proyecto de inversión tanto, más o menos que los hombres? 
•	A esta lista de cotejo hay que volver en diferentes momentos del proceso para evaluar cuál de estas prácticas no se ha integrado suficientemente y elaborar una estrategia para incorporar mejor esos elementos en lo sucesivo.",EN,TRUE,,,,,
C0113,New Info Box,"Ph. A. Step 7 -- New gender box called ""Sex disaggregated data""",,"Add new gender box called ""Sex disaggregated data:"", with the following text for the body:                                                                                                                                                                                     •	The impacts of investment projects are not gender neutral. There can be gender-based discrimination both directly in hiring and employment processes and indirectly by sustaining or exacerbating gender inequality. The potential adverse impacts of investment projects on women and gender diverse peoples violate the principles of equality of rights and nondiscrimination to which they are entitled. 
o	For example, companies often fail to adequately consult with women and gender diverse peoples when negotiating access to land, compensation or benefit-sharing agreements, despite their rights to non-discrimination, information, consultation and participation, especially indigenous women’s right to free, prior, and informed consent. This can disempower and disadvantage women and gender diverse peoples as well as overlook their needs and lead to decisions affecting women on an unequal basis with men. 
(Source: Adapted from Oxfam Australia and Australian Aid entitled A Guide to Gender Impact Assessment for the Extractive Industries)","Données ventilées selon le genre :
•	 Les impacts des projets d'investissement ne sont pas neutres en termes de genre. Il peut y avoir une discrimination fondée sur le genre, tant directement dans les processus d'embauche et d'emploi qu'indirectement en maintenant ou en exacerbant l'inégalité de genres. Les impacts négatifs potentiels des projets d'investissement sur les femmes et des personnes non-conformes au genre violent les principes d'égalité des droits et de non-discrimination auxquels ils ont droit. 
o	Par exemple, les entreprises omettent souvent de consulter adéquatement les femmes et les divers groupes de population lors de la négociation de l'accès à la terre, des compensations ou des accords de partage des avantages, malgré leurs droits à la non-discrimination, à l'information, à la consultation et à la participation, en particulier le droit des femmes autochtones au consentement libre, préalable et éclairé. Cela peut priver les femmes et les personnes non-conformes au genre de tout pouvoir et de tout avantage, négliger leurs besoins et conduire à des décisions qui les affectent de manière inégale par rapport aux hommes. (Source: Adapted from Oxfam Australia and Australian Aid entitled A Guide to Gender Impact Assessment for the Extractive Industries)","Datos desglosados por género: 
•	Los impactos de los proyectos de inversión no son neutrales ante el género. Puede haber discriminación de género tanto de manera directa en los procesos de contratación y empleo como de manera indirecta al sostener o exacerbar la desigualdad de género. Los impactos adversos potenciales de los proyectos de inversión en las mujeres y las personas de género diverso violan los principios de la igualdad de derechos y de la no discriminación a los que tienen derecho dichas personas.
o	Por ejemplo, las empresas suelen no consultar con las mujeres y las personas de género diverso al negociar el acceso a la tierra, la remuneración o los acuerdos de reparto de beneficios, a pesar de sus derechos a la no discriminación, a la información, a la consulta y a la participación, sobre todo el derecho de la mujer indígena al consentimiento libre, previo e informado. Esto puede desempoderar y poner en desventaja a la mujer y a las personas de género diverso, además de pasar por alto sus necesidades y llevar a decisiones que afecten a la mujer en pie de desigualdad con el hombre. 
Fuente: Adaptado de Oxfam Australia y Australian Aid, A Guide to Gender Impact Assessment for the Extractive Industries",EN,TRUE,,,,,
C0114,New Popup,"Ph. A. Step 7 -- New info box called ""Things to consider– Collecting disaggregated data:""",,"Add Pop up called ""Things to consider– Collecting disaggregated data:"", with the following text for the body:                                                                                                                                                                                     •	To assess the impact of the investment project on women, men and gender diverse peoples, data should be collected and presented separately on individuals of various genders. Take a moment at the start of your assessment to plan how your team will consider gender and collect sex disaggregated data throughout the assessment process, to monitor and evaluate the impact of the project on the lives of women and gender diverse peoples. It may also be helpful to collect disaggregated data about other aspects of identity, such as age, ethnicity, disability, religion, and caste, in accordance with local legislation. This will enable a more comprehensive analysis of the data once you have completed your assessment. (See definition of sex-disaggregated data in the Getting Started section that can be accessed from the Welcome page of the tool)","Collecter des données désagrégées :
•	Pour évaluer l'impact du projet d'investissement sur les femmes, les hommes et les personnes non-conformes au genre, les données doivent être collectées et présentées séparément sur les individus de différents genres. Prenez un moment au début de votre évaluation pour planifier la manière dont votre équipe tiendra compte du genre et collectera des données ventilées selon le genre tout au long du processus d'évaluation, afin de suivre et d'évaluer l'impact du projet sur la vie des femmes et des personnes non-conformes au genre. Il peut également être utile de recueillir des données désagrégées sur d'autres aspects de l'identité, tels que l'âge, l'origine ethnique, le handicap, la religion et la caste, conformément à la législation locale. Cela permettra une analyse plus complète des données une fois que vous aurez terminé votre évaluation. (Voir la définition des données ventilées selon le genre dans la section ""Pour bien débuter"" qui se trouve sur la page de bienvenue du guide.)","Recopilación de datos desglosados:
•	A fin de evaluar el impacto del proyecto de inversión en las mujeres, los hombres y las personas de género diverso, los datos se deberían recopilar y presentar por separado respecto a personas de distintos géneros. Dense ustedes un momento al comienzo de su evaluación para planear cómo el equipo considerará el género y recopilará datos desagregados a lo largo del proceso de evaluación, a fin de monitorear y evaluar el impacto del proyecto en la vida de las mujeres y las personas de género diverso. Podría resultar útil, asimismo, recopilar datos desglosados sobre otros aspectos de la identidad, como edad, etnicidad, discapacidad, religión y casta, según la legislación local. Esto permitirá un análisis más integral de los datos una vez que ustedes hayan concluido su valoración. (Véase la definición de datos desglosados por género en la sección Primeros Pasos en la página de bienvenida).",EN,TRUE,,,,,
C0115,New Popup,"Ph. A. Step 7 -- New info box called ""Experience from case studies""",,"Add Pop up called ""Experience from case studies"", with the following text for the body:                                                                                                                                                                                     •	In Peru, the impact assessment revealed a negative impact on the right to adequate housing, as the team found a greater concentration of lead in the walls and floors of homes near the smelter complex. When women spend significantly more time at home than their family, they experience greater exposure to these toxins, which increases the health risks they face.  The impact assessment also revealed pregnant women to be more vulnerable to lead contamination and the toxins emitted by the smelter complex. These pollutants disrupted hormone levels, caused fertility problems, negatively impacted blood health and increased women’s risk of anemia, and increased their likelihood of miscarriage. (Cepema-Lulay, Case study La Oroya)","o	Au Pérou, l'étude d'impact a révélé un impact négatif sur le droit à un logement adéquat, l'équipe ayant constaté une plus grande concentration de plomb dans les murs et les sols des maisons situées à proximité du complexe de la fonderie. Lorsque les femmes passent beaucoup plus de temps à la maison que leur famille, elles sont davantage exposées à ces toxines, ce qui augmente les risques pour leur santé.  L'étude d'impact a également révélé que les femmes enceintes étaient plus vulnérables à la contamination au plomb et aux toxines émises par le complexe de la fonderie. Ces polluants perturbent les niveaux d'hormones, causent des problèmes de fertilité, ont un impact négatif sur la santé du sang et augmentent le risque d'anémie des femmes, ainsi que leur probabilité de faire une fausse couche. (Cepema-Lulay, étude de cas La Oroya)","o	En Perú, la evaluación de impactos reveló un impacto negativo en el derecho a la vivienda adecuada, pues el equipo halló una mayor concentración de plomo en las paredes y los pisos de viviendas cercanas al complejo de fundición. Cuando las mujeres pasan mucho más tiempo en casa que los hombres, quedan más expuestas a estas toxinas, lo que aumenta los riesgos de salud para ellas. La evaluación de impacto reveló también que las embarazadas eran más vulnerables a la contaminación por plomo y a las toxinas emitidas por el complejo de fundición. Estos contaminantes perturbaron las concentraciones de hormonas, causaron problemas de fertilidad, tuvieron un impacto negativo en la sangre y aumentaron tanto el riesgo de anemia como la posibilidad de aborto espontáneo de las mujeres. (Cepema-Lulay, caso de estudio de La Oroya)",EN,TRUE,,,,,
C0116,Edit Text,Ph. A Step 7 -- Different ways of collecting information,"Different ways of collecting information
Meetings and interviews: There are different types of meetings and interviews that you may want to consider. For example, in some cases you may decide to conduct the interview on a personal basis, while in other cases group discussions will be more appropriate. More information on interview types and methods is provided in Step 15. Adequate preparation should be done prior to every meeting or interview, particularly in the development of pertinent questions.

Document analysis: For many parts of the investigation process you will need to examine several documents (such as newspapers, non-governmental organization reports). Government policies and programmes may be found in government documents and company policies on matters relating to human rights may be in the company’s code of conduct.

Experts: In some cases, it may be necessary to seek an expert’s opinion on a specific topic or on where to find certain information. For example, you may need to hire experts to undertake water samples or you may need to collect medical information from local clinics. In other cases, experts may be needed to analyze information that you already have. For example, experts may help analyze a document provided by the company, such as its annual environmental report or water quality data.","Add: o	It may be helpful to utilize creative methods for engaging your team when making a plan for how to collect information. Below are several creative activities that can help teams to generate new ideas and hear everyone’s perspectives.
▪	Generating Ideas from everyone in a large group: https://www.sessionlab.com/methods/1-2-4-all
▪	Introvert Friendly Idea Generation: https://www.sessionlab.com/methods/walking-brainstorm
▪	More tools can be found at: https://www.sessionlab.com/library/issue-analysis","•	Il peut être utile d'utiliser des méthodes créatives pour faire participer votre équipe lors de l'élaboration d'un plan pour la collecte d'informations. Vous trouverez ci-dessous plusieurs activités créatives qui peuvent aider les équipes à générer de nouvelles idées et à entendre les perspectives de chacun.
▪	Générer des idées de tout le monde dans un grand groupe : https://www.sessionlab.com/methods/1-2-4-all
▪	Génération d'idées adaptée aux introvertis : https://www.sessionlab.com/methods/walking-brainstorm
▪	Vous trouverez d'autres outils à l'adresse suivante : https://www.sessionlab.com/library/issue-analysis","o	Podría ser provechoso utilizar métodos creativos para la interacción del equipo al trazar un plan para la recopilación de la información. A continuación ofrecemos distintas actividades creativas que pueden servir para que los equipos generen nuevas ideas y oigan las perspectivas de cada persona.
▪	Generar ideas de todos en un grupo grande: https://www.sessionlab.com/methods/1-2-4-all
▪	Generación de ideas para personas introvertidas: https://www.sessionlab.com/methods/walking-brainstorm
▪	Para consultar más herramientas, pueden acudir a: https://www.sessionlab.com/library/issue-analysis",EN,,TRUE,,,,
C0118,New Info Box,Ph. A Step 8 -- New gender info box,,"Add new onscreen gender box: When developing the work plan and attributing responsibilities, make sure to provide adequate resources to enable everyone on the team to take on meaningful roles and responsibilities. Special attention should be paid so that women and gender diverse peoples are supported and able to take on decision making roles. This can help create a gender transformative process. (ADD A LEARN MORE ICON HERE)","Lors de l'élaboration du plan de travail et de l'attribution des responsabilités, veillez à fournir des ressources adéquates pour permettre à chaque membre de l'équipe d'assumer des rôles et des responsabilités significatifs. Il convient de veiller tout particulièrement à ce que les femmes et les personnes non-conformes au genre soient soutenues et puissent assumer des rôles décisionnels. Cela peut contribuer à créer un processus de transformation du genre. (Pour en savoir plus, cliquez sur l'icône)","Al desarrollar el plan de trabajo y atribuir responsabilidades, cerciórense de proporcionar recursos adecuados que le permitan a cada integrante del equipo asumir papeles y responsabilidades adecuados. Es preciso dedicar atención especial para que las mujeres y las personas de género diverso tengan apoyo y puedan asumir papeles de toma de decisiones. Esto puede contribuir a crear un proceso transformativo de género. (Icono de “Para saber más”)",EN,TRUE,,,,,
C0119,New Info Box,"Ph. A. Step 7 -- New gender info box called ""Incorporating Gender into your assessment""",,"Add new gender info box with name: ""Incorporating Gender into your assessment "", and the following text for the body:
•	Take time to envision how you will incorporate gender into your assessment, and keep in mind the possibility that any negative impacts of the project will be born disproportionately by women and gender diverse peoples as you begin this process. If so, you may want to consider selecting the right to gender equality in step 13 & 14 to evaluate these gendered effects more extensively. If not, given the nature of the right to gender equality as a cross-cutting principle, gender considerations are incorporated into all other rights listed in Step 13. See examples of gender impacts in step 15. 
•	The inclusion of representative gender composition and gender expertise on your team, women and minorities among consulted community members, and sex-disaggregated data will strengthen the credibility of your process.","Intégrer le genre dans votre évaluation
•	Prenez le temps d'envisager comment vous allez intégrer le genre dans votre évaluation, et gardez à l'esprit la possibilité que tout impact négatif du projet sera supporté de manière disproportionnée par les femmes et les personnes non-conformes au genre lorsque vous commencez ce processus. Si c'est le cas, vous pouvez envisager de sélectionner le droit à l'égalité de genre aux étapes 13 et 14 pour évaluer ces effets sexospécifiques de manière plus approfondie. Sinon, étant donné la nature du droit à l'égalité de genre en tant que principe transversal, les considérations de genre sont incorporées dans tous les autres droits énumérés à l'étape 13. Voir les exemples d'effets sexospécifiques à l'étape 15. 
•	L'inclusion d'une composition de genre représentative et d'une expertise en matière de genre dans votre équipe, de femmes et de minorités parmi les membres de la communauté consultés, et de données ventilées selon le genre renforcera la crédibilité de votre processus.","Incorporar el Género a su evaluación 
•	Dense el tiempo de contemplar cómo van a incorporar el género a su evaluación y tengan presente la posibilidad de que algún impacto negativo del proyecto lo sobrelleven de manera desproporcionada las mujeres y las personas de género diverso al comenzar el proceso. En caso afirmativo, tal vez convenga seleccionar el derecho a la igualdad de género en los Pasos 13 y 14 para evaluar de manera más extensa estos efectos de género. En caso negativo, dada la índole del derecho a la igualdad de género como principio transversal, se incorporan consideraciones de género a todos los otros derechos enunciados en el Paso 13. Véanse ejemplos de impactos de género en el Paso 15. 
•	La inclusión de una composición de género y experticia de género representativas en su equipo, mujeres y minorías entre las personas de la comunidad consultadas y datos desglosados por género fortalecerá la credibilidad de su proceso.",EN,TRUE,,,,,
