ReferenceID,TypeofChange,Location,OldText,NewTextEN,NewTextFR,NewTextES,Language,Change to Structure,Text Change,Owner,LocationofJSON,Priority,Complete
C0233,New Popup,"Ph. D Step 16 -- New ""Experiences"" Tab",,"Add new ""Experiences"" tab, with the following text: « To gather the perspectives of the government, we conducted interviews with representatives of all government agencies that were somehow involved in the conflict, as well as interviews with representatives of civil society organizations that have been keeping track of it. It is worth mentioning how difficult it was to collect information from government agencies, mainly due to the lack of computerized records at the time when the facts took place, to changes in the system that was used back then, and also to the poor management of the physical les of the documents. These factors made it difficult, or even impossible in some cases, for us to access the information we wanted to collect.” (Brazil)

“Government officials to be interviewed were determined based on the interference, relationship, or impact of the respective public services, whether in the authorization or supervision of the mining projects carried out in the territory of the community or on their resources (land, water, environment, natural resources, social fabric, and road infrastructure). We also chose government officials from public institutions in charge of implementing indigenous policy in Chile to be interviewed. In total, we interviewed 15 officials from the different services.
In addition to the information gathered in the interviews, this work included a review of documentation, legislation, and specific case law with respect to the community and the aforementioned mining projects, as well as on human rights and indigenous peoples’ rights.” (Chile)","Add new ""Experiences"" tab, with the following text:
"" Pour recueillir le point de vue du gouvernement, nous avons mené des entretiens avec des représentants de toutes les agences gouvernementales qui ont été impliquées d'une manière ou d'une autre dans le conflit, ainsi que des entretiens avec des représentants d'organisations de la société civile qui en ont assuré le suivi. Il convient de mentionner à quel point il a été difficile de recueillir des informations auprès des agences gouvernementales, principalement en raison de l'absence de dossiers informatisés à l'époque des faits, des changements dans le système utilisé à l'époque, et aussi de la mauvaise gestion des documents physiques. Ces facteurs ont rendu difficile, voire impossible dans certains cas, l'accès aux informations que nous voulions collecter."" (Brésil)
""Les fonctionnaires gouvernementaux à interviewer ont été déterminés en fonction de l'interférence, de la relation ou de l'impact des services publics respectifs, que ce soit dans l'autorisation ou la supervision des projets miniers réalisés sur le territoire de la communauté ou sur leurs ressources (terre, eau, environnement, ressources naturelles, tissu social et infrastructures routières). Nous avons également choisi d'interviewer des fonctionnaires des institutions publiques chargées de la mise en œuvre de la politique indigène au Chili. Au total, nous avons interrogé 15 fonctionnaires des différents services.
Outre les informations recueillies lors des entretiens, ce travail a comporté un examen de la documentation, de la législation et de la jurisprudence spécifique en ce qui concerne la communauté et les projets miniers susmentionnés, ainsi que sur les droits humains et les droits des peuples autochtones."" (Chili)","Add new expertience tab with the following text:
« Para reunir las perspectivas del Gobierno, realizamos entrevistas con representantes de todos los órganos gubernamentales que de algún modo se implicaron en el conflicto, así como entrevistas con representantes de organizaciones de la sociedad civil que hubieran estado pendientes del conflicto. Cabe resaltar aquí lo difícil que fue reunir información del Poder Público, principalmente debido a la falta de informatización de la época de los hechos, al cambios en el sistema utilizado y también al mal mantenimiento del archivo físico de los documentos. Estos factores nos dificultaron o hasta nos impidieron en algunos casos el acceso a la información que queríamos reunir”. (Brasil)

“Se determinó a qué funcionarios de gobierno entrevistar con base en la injerencia, relación o impacto de los servicios públicos respectivos, ya fuera en la autorización o supervisión de los proyectos mineros realizados en el territorio de la comunidad o en sus recursos (tierra, agua, ambiente, recursos naturales, textura social e infraestructura de caminos). Además, escogimos para las entrevistas a funcionarios de gobierno de instituciones públicas a cargo de la implementación de la política hacia los indígenas en Chile. En total, entrevistamos a 15 funcionarios de los distintos servicios.
Además de la información reunida en las entrevistas, este trabajo incluyó una revisión de documentación, legislación y jurisprudencia con respecto a la comunidad y los proyectos mineros ya citados, así como de derechos humanos y derechos de los pueblos indígenas”. (Chile)",EN,TRUE,,,,,
C0281,Edit Text,Ph. D Step 16 -- Human Rights in Practice -- After second paragraph,,"After second paragraph, add the following text: Familiarize yourself with the human rights record of the country by exploring the country profiles on civil society websites such as Human Rights Watch, Amnesty International, and Oxfam to determine if they have been involved in human rights abuses in the past (these organizations not only produce long, detailed reports but also shorter briefs and news articles perfect for preliminary research exploration)","After second paragraph, add the following text:
Familiarisez-vous avec le bilan du pays en matière de droits humains en explorant les profils de pays sur des sites Web de la société civile tels que Human Rights Watch, Amnesty International et Oxfam, afin de déterminer s'ils ont été impliqués dans des violations des droits humains dans le passé (ces organisations produisent non seulement des rapports longs et détaillés, mais aussi des mémoires et des articles d'actualité plus courts, parfaits pour l'exploration préliminaire).","After seconf paragraph, add the following text:
Familiarícese con el historial de derechos humanos del país mediante una exploración de los perfiles de países en sitios web de la sociedad civil como Human Rights Watch, Amnistía Internacional y Oxfam a fin de determinar si han estado implicados en violaciones a los derechos humanos o en algún informe anterior del modo que haya sido (estas organizaciones no solo generan informes extensos y detallados, sino también resúmenes y artículos de noticias más breves que son perfectos para la exploración de la investigación preliminar).",EN,,TRUE,,,,
C0234,Edit Text,Ph. D Step 16 -- Worth browsing tab,,,"How is the government ensuring protection of women’s rights?
▪	Voici quelques ressources intéressantes à prendre en compte lorsque vous examinez la politique, la pratique et le comportement du pays en matière d'égalité de genre et de non-discrimination. Dans beaucoup de ces ressources, vous pouvez trouver des informations spécifiques sur votre pays : 
•	The World Bank, Gender Data Portal: http://datatopics.worldbank.org/gender/indicators 
•	Global gender gap report, World Economic Forum (2017), https://fr.weforum.org/reports/global-gender-gap-report-2021
•	Rapports sur l’Indice de Développement Humain par pays: http://hdr.undp.org/en/countries (présentent des données ventilées selon le genre)
•	Examen périodique universel: analyse de la situation des droits humains des 193 pays membres des Nations Unies réalisée par le Groupe du travail de l’EPU. https://www.ohchr.org/FR/HRBodies/UPR/Pages/Documentation.aspx 
•	Le Groupe de travail sur la discrimination à l’égard des femmes et des filles réalise des études par pays pour examiner la situation de la discrimination contre les femmes dans les lois et au niveau des pratiques dans le pays.  Ces études incluent des recommandations au gouvernement: https://www.ohchr.org/FR/Issues/Women/WGWomen/Pages/WGWomenIndex.aspx
•	Rapport par pays produit par le gouvernement des États Unies : www.state.gov/reports-bureau-of-democracy-human-rights-and-labor/country-reports-on-human-rights-practices/
•	Études économiques et sectorielles de la Banque Mondiale: https://openknowledge.worldbank.org/handle/10986/6?locale-attribute=fr (comprend des diagnostiques tels que l’évaluation de la gouvernance d’entreprise, l’évaluation de la pauvreté, l’analyse environnementale par pays, etc. ainsi que des études thématiques et par secteurs tels que les évaluations de la question de genre par pays : https://openknowledge.worldbank.org/handle/10986/6?locale-attribute=fr 
•	Données ouvertes de la Banque Mondiale :Visitez ce site pour trouver des informations par pays ou par indicateur : https://donnees.banquemondiale.org/
•	Vivre libres et égaux : comment les États luttent contre la violence et la discrimination contre les personnes LGBTI :www.unfe.org/fr/learn-more/
•	Nés libres et égaux : orientation sexuelle et identité de genre en droit international des droits de l’homme : www.unfe.org/fr/learn-more/ 
•	Note d'information sur les personnes intersexes (octobre 2019) www.ohchr.org/Documents/Issues/Discrimination/LGBT/BackgroundNoteHumanRightsViolationsagainstIntersexPeople.pdf
•	Femmes et Filles vivant avec un handicap (en anglais): www.un.org/development/desa/disabilities/issues/women-and-girls-with-disabilities.html
•	Gender and Indigenous Peoples Human Rights: UN report (en anglais) www.un.org/esa/socdev/unpfii/documents/BriefingNote6_GREY.pdf","How is the government ensuring protection of women’s rights?
▪	Ofrecemos a continuación algunos recursos interesantes de considerar al analizar las políticas, las prácticas y las conductas del país en materia de igualdad de género y no discriminación. En muchos de estos recursos podrán encontrar información específica sobre su país: 
•	Banco Mundial, Portal de Datos de Género (Gender Data Portal): http://datatopics.worldbank.org/gender/indicators 
•	Informe Mundial de Disparidad entre los Géneros, Foro Económico Mundial (2017) The Global Gender Gap Report 2017 | Foro Económico Mundial (weforum.org)
•	Informes de Desarrollo Humano por país: http://hdr.undp.org/en/countries (incluye datos desglosados por genero)
•	Examen Periódico Universal: historiales de derechos humanos de los 193 Estados miembros de la ONU elaborados por el Grupo de Trabajo del EPU: https://www.ohchr.org/SP/HRBodies/UPR/Pages/Documentation.aspx
•	El Grupo de Trabajo sobre la cuestión de la discriminación contra la mujer elabora estudios de caso por cada país en los que se examina la discriminación contra la mujer en la legislación y en la práctica en el ámbito nacional (incluye recomendaciones para el respectivo gobierno); los países examinados hasta ahora son Chad, Samoa, Kuwait, Hungría, Estados Unidos, Senegal, España, Perú, Chile, China, Islandia, Túnez, Moldavia, Marruecos
•	Informes de derechos humanos por país elaborados por el Departamento de Estado del Gobierno de Estados Unidos: https://www.state.gov/reports-bureau-of-democracy-human-rights-and-labor/country-reports-on-human-rights-practices/
•	Estudios Económicos y Sectoriales (EES) del Banco Mundial: https://openknowledge.worldbank.org/handle/10986/6 (abarcan diagnósticos fundamentales como Evaluación de Gobernanza Empresarial, Análisis Ambiental Nacional, Evaluación de Pobreza, etc., así como Estudios Sectoriales / Temáticos tales como Evaluación Nacional de Género, Minería Petróleo y Gas, etc.; Sondeos Empresariales)
o	Aquí podrán buscar por país o indicador: https://data.worldbank.org/
•	Vivir libres e iguales: Qué están haciendo los Estados para abordar la violencia y discriminación contra las personas lesbianas, gays, bisexuales, transgénero e intersex (https://www.ohchr.org/Documents/Publications/LivingFreeAndEqual_SP.pdf)
•	Nacer libres e iguales: Informe de la ONU sobre las obligaciones de los Estados de proteger los derechos humanos de las personas LGBTI (Born Free and Equal: UN report on the obligations of States to protect the human rights of LGBTI individuals, disponible solo en inglés) (https://www.ohchr.org/Documents/Publications/Born_Free_and_Equal_WEB.pdf)
•	Nota de antecedentes sobre violaciones de los derechos humanos contra las personas intersex (https://www.ohchr.org/Documents/Issues/Discrimination/LGBT/BackgroundNoteHumanRightsViolationsagainstIntersexPeople.pdf)
•	Mujeres y niñas con discapacidades: Informe de la ONU sobre los abusos específicos que enfrentan las mujeres de niveles de capacidad diferentes (Women and Girls with Disabilities: UN report on the specific abuses that women with different ability levels face) (https://www.un.org/development/desa/disabilities/issues/women-and-girls-with-disabilities.html)
•	El género y los derechos humanos de los pueblos indígenas: informe de la ONU (Gender and Indigenous Peoples Human Rights: UN report) https://www.un.org/esa/socdev/unpfii/documents/BriefingNote6_GREY.pdf",,,TRUE,,,,
